Text;Entities
"„Podczas gdy szefowie firmy Chipotle przyznali, że queso było zdecydowanie najbardziej pożądaną przez klientów pozycją w menu, sieć burrito przez lata walczyła o stworzenie przepisu na queso, który spełniałby jej surowe wymagania dla wszystkich naturalnych produktów spożywczych, a jednocześnie dobrze smakował. „Dodatki sprawiają, że typowe queso jest bardzo spójne i przewidywalne, ale wcale nie są zgodne z naszą kulturą żywieniową”, źródło: https://www.thrillist.com/news/nation/chipotle-queso-dip-ingredients-recipe """;"[(""Chipotle"", ""orgName"", (28, 36))]"
"„OK, znalazłem to zgłoszenie przez JCI na stronie internetowej SEC: Konsekwencje wypłaty amerykańskiego federalnego podatku dochodowego na rzecz amerykańskich posiadaczy Do celów amerykańskiego federalnego podatku dochodowego wypłata nie kwalifikuje się do traktowania jako zwolniona z podatku dystrybucja przez Johnson Controls z W związku z tym wypłata będzie traktowana jako podlegająca opodatkowaniu wypłata przez Johnson Controls na rzecz każdego akcjonariusza Johnson Controls w kwocie równej wartości rynkowej akcji zwykłych firmy Adient otrzymanych przez takiego akcjonariusza (w tym wszelkich akcji ułamkowych uznanych za otrzymane i wszelkie akcje zwykłe firmy Adient potrącone ze względu na irlandzkie podatki u źródła), ustalone na dzień wypłaty (taka kwota, „Kwota wypłaty""). Kwota wypłaty otrzymana przez posiadacza w USA będzie traktowana jako podlegająca opodatkowaniu dywidenda na rzecz zakres podlegającego opodatkowaniu udziału takiego posiadacza USA w bieżących lub skumulowanych dochodach i zyskach Johnson Controls za rok podatkowy wypłaty (określony zgodnie z zgodnie z amerykańskimi zasadami federalnego podatku dochodowego). Jakakolwiek część Kwoty Wypłaty, która jest traktowana jako dywidenda, nie będzie kwalifikować się do odliczenia otrzymanych dywidend, które jest dozwolone dla korporacji na mocy Kodeksu. Formularz 1099-B mojego brokera mówi mi, że otrzymałem Dywidendę Kwalifikowaną od JCI w dniu 31.10.2016 w wysokości 512,44 USD, co odpowiadałoby wycenie ADNT 45,349 USD na dzień wydzielenia dla moich 11,3 akcji (przed sprzedażą 0,3 akcji jako gotówka w zastępstwie) ”.";"[(""JCI"", ""orgName"", (35, 38)), (""SEC"", ""orgName"", (63, 66)), (""Johnson Controls"", ""orgName"", (312, 328)), (""Johnson Controls"", ""orgName"", (418, 434)), (""Johnson Controls"", ""orgName"", (466, 482)), (""Adient"", ""orgName"", (538, 544)), (""Adient"", ""orgName"", (671, 677)), (""USA"", ""placeName"", (832, 835)), (""USA"", ""placeName"", (966, 969)), (""Johnson Controls"", ""orgName"", (1020, 1036)), (""JCI"", ""orgName"", (1420, 1423)), (""31.10.2016"", ""date"", (1431, 1441)), (""ADNT"", ""orgName"", (1491, 1495))]"
Tak więc były dyrektor generalny American Airlines uważa, że ​​pracownicy nigdy nie powinni oczekiwać, że będą radzić sobie lepiej niż pracownicy ich konkurentów i że ich zadaniem jest usiąść i zamknąć się, podczas gdy dyrektorzy robią to, co uważają za najlepsze. Jakoś wyobrażam sobie, że piloci są mniej niż przekonani do tego toku rozumowania.;"[(""American Airlines"", ""orgName"", (33, 50))]"
Przywódca Chin Xi Jinping napisał w liście do Rady Biznesu USA-Chiny (USCBC), że Chińska Republika Ludowa jest gotowa utrzymywać komunikację ze Stanami Zjednoczonymi i poszukiwać właściwej drogi pokojowej koegzystencji z korzyścią dla obu krajów i świata — podają w czwartek państwowe media w ChRL.;"[(""Przywódca Chin Xi Jinping"", ""persName"", (15, 25)), (""Rady Biznesu USA-Chiny (USCBC)"", ""orgName"", (46, 76)), (""ChRL"", ""placeName"", (293, 297))]"
Prognoza pogody dla miasta Kraków. Co przyniesie aura w dniu 10.12.2024? Prezentujemy najnowsze przewidywania meteorologów. Prognoza pogody - województwo małopolskie. Czy warunki dziś pozwolą na spokojny spacer?;"[(""Kraków"", ""placeName"", (27, 33)), (""10.12.2024"", ""date"", (61, 71)), (""województwo małopolskie"", ""placeName"", (142, 165))]"
Jan Paweł 2 był papieżem pochodzącym z Polski, urzędujacym w Watykanie.;"[(""Jan Paweł 2"",""persName"",(0,11)),(""Polski"",""placeName"",(39,45)),(""Watykanie"",""placeName"",(61,70))]"
Chainsaw Man opowiada historię Denjiego, łowcy demonów mieszkającego w Japonii,który zarabia na życie zabijając demony, a jego głównym celem jest zdobycie względów Makimy.;"[(""Chainsaw Man"",""persName"",(0,12)),(""Denjiego"",""persName"",(31,39)),(""Japonii"",""placeName"",(71,78)),(""Makimy"",""persName"",(165,171))]"
Amazon jest firmą prowadzoną przez Jeff Bezosa i jest bezkonkurencyjnym dostawcą produktów na całym świecie, chociaż osobiście nie podoba mi się tego jak potraktowali Tomka zwalniając go w sobotę 9 stycznia.;"[(""Amazon"",""orgName"",(0,7)),(""Jeff Bezos"",""persName"",(36,46)),(""Tomka"",""persName"",(169,174)),(""sobotę 9 stycznia"",""date"",(190,209))]"
